{"datasetId":"koto-expression-candidate-triage","schemaVersion":1,"packId":"triage-001","recordCount":250,"records":[{"candidateId":"candidate:jmdict:2215430","sourceSequence":2215430,"automatedScore":86,"automatedRoute":"priority-family-review","suggestedCategory":"social-formula","clusterHint":"には","signals":["compact-form","related-entry-links","social-formula-gloss","strong-source-priority"],"riskFlags":[],"editorialAssignment":null,"editorialDisposition":"outcome:jmdict-2215430"},{"candidateId":"candidate:jmdict:2028950","sourceSequence":2028950,"automatedScore":56,"automatedRoute":"standard-family-review","suggestedCategory":"grammar-pattern","clusterHint":"とは","signals":["compact-form","grammar-review-needed","related-entry-links","strong-source-priority"],"riskFlags":[],"editorialAssignment":null,"editorialDisposition":null},{"candidateId":"candidate:jmdict:1009610","sourceSequence":1009610,"automatedScore":53,"automatedRoute":"low-priority-review","suggestedCategory":"grammar-pattern","clusterHint":"にも","signals":["compact-form","grammar-review-needed","strong-source-priority"],"riskFlags":[],"editorialAssignment":null,"editorialDisposition":null},{"candidateId":"candidate:jmdict:2849387","sourceSequence":2849387,"automatedScore":56,"automatedRoute":"standard-family-review","suggestedCategory":"grammar-pattern","clusterHint":"のだ","signals":["compact-form","grammar-review-needed","related-entry-links","strong-source-priority"],"riskFlags":[],"editorialAssignment":"expression:give-explanatory-background","editorialDisposition":null},{"candidateId":"candidate:jmdict:2823770","sourceSequence":2823770,"automatedScore":53,"automatedRoute":"low-priority-review","suggestedCategory":"grammar-pattern","clusterHint":"ではない","signals":["compact-form","grammar-review-needed","strong-source-priority"],"riskFlags":[],"editorialAssignment":null,"editorialDisposition":null},{"candidateId":"candidate:jmdict:2871200","sourceSequence":2871200,"automatedScore":56,"automatedRoute":"standard-family-review","suggestedCategory":"grammar-pattern","clusterHint":"かと","signals":["compact-form","grammar-review-needed","related-entry-links","strong-source-priority"],"riskFlags":[],"editorialAssignment":null,"editorialDisposition":null},{"candidateId":"candidate:jmdict:2087820","sourceSequence":2087820,"automatedScore":53,"automatedRoute":"low-priority-review","suggestedCategory":"grammar-pattern","clusterHint":"のです","signals":["compact-form","grammar-review-needed","strong-source-priority"],"riskFlags":[],"editorialAssignment":null,"editorialDisposition":null},{"candidateId":"candidate:jmdict:2026640","sourceSequence":2026640,"automatedScore":53,"automatedRoute":"low-priority-review","suggestedCategory":"grammar-pattern","clusterHint":"にしても","signals":["compact-form","grammar-review-needed","strong-source-priority"],"riskFlags":[],"editorialAssignment":null,"editorialDisposition":null},{"candidateId":"candidate:jmdict:2136890","sourceSequence":2136890,"automatedScore":53,"automatedRoute":"low-priority-review","suggestedCategory":"grammar-pattern","clusterHint":"とする","signals":["compact-form","grammar-review-needed","strong-source-priority"],"riskFlags":[],"editorialAssignment":null,"editorialDisposition":null},{"candidateId":"candidate:jmdict:2841254","sourceSequence":2841254,"automatedScore":56,"automatedRoute":"standard-family-review","suggestedCategory":"grammar-pattern","clusterHint":"からって","signals":["compact-form","grammar-review-needed","related-entry-links","strong-source-priority"],"riskFlags":[],"editorialAssignment":"expression:just-because-does-not-mean","editorialDisposition":null},{"candidateId":"candidate:jmdict:2667510","sourceSequence":2667510,"automatedScore":56,"automatedRoute":"standard-family-review","suggestedCategory":"grammar-pattern","clusterHint":"よね","signals":["compact-form","grammar-review-needed","related-entry-links","strong-source-priority"],"riskFlags":[],"editorialAssignment":"expression:seek-shared-confirmation","editorialDisposition":null},{"candidateId":"candidate:jmdict:2457920","sourceSequence":2457920,"automatedScore":68,"automatedRoute":"standard-family-review","suggestedCategory":"grammar-pattern","clusterHint":"ですか","signals":["compact-form","grammar-review-needed","register-marked","related-entry-links","strong-source-priority"],"riskFlags":[],"editorialAssignment":null,"editorialDisposition":null},{"candidateId":"candidate:jmdict:2027020","sourceSequence":2027020,"automatedScore":56,"automatedRoute":"standard-family-review","suggestedCategory":"grammar-pattern","clusterHint":"ではないか","signals":["compact-form","grammar-review-needed","kana-conventional","strong-source-priority"],"riskFlags":[],"editorialAssignment":null,"editorialDisposition":null},{"candidateId":"candidate:jmdict:2585220","sourceSequence":2585220,"automatedScore":66,"automatedRoute":"standard-family-review","suggestedCategory":"other-expression","clusterHint":"ことがない","signals":["compact-form","kana-conventional","strong-source-priority"],"riskFlags":[],"editorialAssignment":"expression:say-never-occurs","editorialDisposition":null},{"candidateId":"candidate:jmdict:2088970","sourceSequence":2088970,"automatedScore":63,"automatedRoute":"standard-family-review","suggestedCategory":"other-expression","clusterHint":"しないのではないか","signals":["compact-form","strong-source-priority"],"riskFlags":[],"editorialAssignment":null,"editorialDisposition":null},{"candidateId":"candidate:jmdict:1534560","sourceSequence":1534560,"automatedScore":63,"automatedRoute":"standard-family-review","suggestedCategory":"other-expression","clusterHint":"このは","signals":["compact-form","strong-source-priority"],"riskFlags":[],"editorialAssignment":null,"editorialDisposition":null},{"candidateId":"candidate:jmdict:2872982","sourceSequence":2872982,"automatedScore":56,"automatedRoute":"standard-family-review","suggestedCategory":"grammar-pattern","clusterHint":"といい","signals":["compact-form","grammar-review-needed","kana-conventional","strong-source-priority"],"riskFlags":[],"editorialAssignment":"expression:wish-good-outcome","editorialDisposition":null},{"candidateId":"candidate:jmdict:1004540","sourceSequence":1004540,"automatedScore":69,"automatedRoute":"standard-family-review","suggestedCategory":"other-expression","clusterHint":"ことがある","signals":["compact-form","kana-conventional","related-entry-links","strong-source-priority"],"riskFlags":[],"editorialAssignment":"expression:describe-experience-or-occasional-event","editorialDisposition":null},{"candidateId":"candidate:jmdict:1013110","sourceSequence":1013110,"automatedScore":56,"automatedRoute":"standard-family-review","suggestedCategory":"grammar-pattern","clusterHint":"ように","signals":["compact-form","grammar-review-needed","kana-conventional","strong-source-priority"],"riskFlags":[],"editorialAssignment":"expression:so-that-ensure","editorialDisposition":null},{"candidateId":"candidate:jmdict:1004800","sourceSequence":1004800,"automatedScore":63,"automatedRoute":"standard-family-review","suggestedCategory":"other-expression","clusterHint":"これで","signals":["compact-form","strong-source-priority"],"riskFlags":[],"editorialAssignment":null,"editorialDisposition":null},{"candidateId":"candidate:jmdict:2008650","sourceSequence":2008650,"automatedScore":66,"automatedRoute":"standard-family-review","suggestedCategory":"other-expression","clusterHint":"そうした","signals":["compact-form","kana-conventional","strong-source-priority"],"riskFlags":[],"editorialAssignment":null,"editorialDisposition":null},{"candidateId":"candidate:jmdict:1006650","sourceSequence":1006650,"automatedScore":63,"automatedRoute":"standard-family-review","suggestedCategory":"other-expression","clusterHint":"そうだ","signals":["compact-form","strong-source-priority"],"riskFlags":[],"editorialAssignment":null,"editorialDisposition":null},{"candidateId":"candidate:jmdict:2093030","sourceSequence":2093030,"automatedScore":76,"automatedRoute":"priority-family-review","suggestedCategory":"interaction-management","clusterHint":"そうか","signals":["compact-form","interaction-gloss","related-entry-links","strong-source-priority"],"riskFlags":[],"editorialAssignment":"expression:respond-souka","editorialDisposition":null},{"candidateId":"candidate:jmdict:1006900","sourceSequence":1006900,"automatedScore":63,"automatedRoute":"standard-family-review","suggestedCategory":"other-expression","clusterHint":"そのほか","signals":["compact-form","strong-source-priority"],"riskFlags":[],"editorialAssignment":null,"editorialDisposition":null},{"candidateId":"candidate:jmdict:2755350","sourceSequence":2755350,"automatedScore":63,"automatedRoute":"standard-family-review","suggestedCategory":"other-expression","clusterHint":"じゃない","signals":["compact-form","strong-source-priority"],"riskFlags":[],"editorialAssignment":null,"editorialDisposition":null},{"candidateId":"candidate:jmdict:2837492","sourceSequence":2837492,"automatedScore":75,"automatedRoute":"priority-family-review","suggestedCategory":"other-expression","clusterHint":"そうです","signals":["compact-form","register-marked","strong-source-priority"],"riskFlags":[],"editorialAssignment":"expression:report-hearsay-soudesu","editorialDisposition":null},{"candidateId":"candidate:jmdict:2008660","sourceSequence":2008660,"automatedScore":63,"automatedRoute":"standard-family-review","suggestedCategory":"other-expression","clusterHint":"そうですが","signals":["compact-form","strong-source-priority"],"riskFlags":[],"editorialAssignment":null,"editorialDisposition":null},{"candidateId":"candidate:jmdict:2829960","sourceSequence":2829960,"automatedScore":63,"automatedRoute":"standard-family-review","suggestedCategory":"other-expression","clusterHint":"いいね","signals":["compact-form","strong-source-priority"],"riskFlags":[],"editorialAssignment":null,"editorialDisposition":null},{"candidateId":"candidate:jmdict:1922760","sourceSequence":1922760,"automatedScore":56,"automatedRoute":"standard-family-review","suggestedCategory":"gra